{
    "$schema": "https://json-schema.org/draft/2020-12/schema",
    "$id": "https://raw.githubusercontent.com/ivanfuhr/stencil/main/registry/schema/registry-item.json",
    "title": "Stencil registry item",
    "type": "object",
    "additionalProperties": false,
    "properties": {
        "$schema": {
            "type": "string"
        },
        "name": {
            "type": "string"
        },
        "type": {
            "type": "string"
        },
        "title": {
            "type": "string"
        },
        "description": {
            "type": "string"
        },
        "registryDependencies": {
            "type": "array",
            "items": {
                "type": "string"
            }
        },
        "iconDependencies": {
            "type": "array",
            "items": {
                "type": "string"
            }
        },
        "dependencies": {
            "type": "array",
            "items": {
                "type": "string"
            }
        },
        "devDependencies": {
            "type": "array",
            "items": {
                "type": "string"
            }
        },
        "files": {
            "type": "array",
            "items": {
                "$ref": "#/$defs/file"
            }
        }
    },
    "required": ["name", "type", "files"],
    "$defs": {
        "file": {
            "type": "object",
            "additionalProperties": false,
            "properties": {
                "path": {
                    "type": "string"
                },
                "type": {
                    "type": "string"
                },
                "target": {
                    "type": "string"
                },
                "content": {
                    "type": "string"
                }
            },
            "required": ["path", "type", "content"]
        }
    }
}
