{
    "$schema": "../schema/registry-item.json",
    "name": "avatar",
    "type": "registry:ui",
    "title": "Avatar",
    "description": "User image or initials with sizes, colors, circle mode, and grouped stacks.",
    "registryDependencies": [],
    "files": [
        {
            "path": "avatar/fallback.blade.php",
            "type": "registry:ui",
            "target": "avatar/fallback.blade.php",
            "content": "<span {{\n    $attributes->class([\n        'avatar__fallback',\n        'flex size-full items-center justify-center',\n    ])->merge([\n        'data-avatar-fallback' => true,\n    ])\n}}>\n    {{ $slot }}\n</span>\n"
        },
        {
            "path": "avatar/group.blade.php",
            "type": "registry:ui",
            "target": "avatar/group.blade.php",
            "content": "<div {{\n    $attributes->class([\n        'avatar-group',\n        'flex items-center -space-x-2',\n        '*:ring-2 *:ring-white dark:*:ring-zinc-950',\n    ])->merge([\n        'data-avatar-group' => true,\n    ])\n}}>\n    {{ $slot }}\n</div>\n"
        },
        {
            "path": "avatar/image.blade.php",
            "type": "registry:ui",
            "target": "avatar/image.blade.php",
            "content": "@props([\n    'src',\n    'alt' => 'Avatar',\n])\n\n<img {{\n    $attributes->class([\n        'avatar__image',\n        'aspect-square size-full object-cover',\n    ])->merge([\n        'src' => $src,\n        'alt' => $alt,\n        'data-avatar-image' => true,\n    ])\n}} />\n"
        },
        {
            "path": "avatar/index.blade.php",
            "type": "registry:ui",
            "target": "avatar/index.blade.php",
            "content": "@props([\n    'src' => null,\n    'alt' => null,\n    'name' => null,\n    'initials' => null,\n    'size' => 'md',\n    'circle' => false,\n    'color' => null,\n    'href' => null,\n    'as' => null,\n])\n\n@php\n    $sizeClasses = match ($size) {\n        'xs' => 'size-6 text-[10px]',\n        'sm' => 'size-8 text-xs',\n        'lg' => 'size-12 text-base',\n        'xl' => 'size-16 text-lg',\n        default => 'size-10 text-sm',\n    };\n\n    if (filled($initials)) {\n        $resolvedInitials = (string) $initials;\n    } elseif (filled($name)) {\n        $parts = preg_split('/\\s+/', trim((string) $name)) ?: [];\n        $resolvedInitials = collect($parts)\n            ->filter()\n            ->take(2)\n            ->map(fn (string $part): string => mb_strtoupper(mb_substr($part, 0, 1)))\n            ->implode('');\n\n        if ($resolvedInitials === '' && filled($name)) {\n            $resolvedInitials = mb_strtoupper(mb_substr((string) $name, 0, 2));\n        }\n    } else {\n        $resolvedInitials = null;\n    }\n\n    $resolvedAlt = $alt ?? $name ?? 'Avatar';\n\n    $palette = [\n        'bg-red-100 text-red-700 dark:bg-red-950 dark:text-red-300',\n        'bg-orange-100 text-orange-700 dark:bg-orange-950 dark:text-orange-300',\n        'bg-amber-100 text-amber-800 dark:bg-amber-950 dark:text-amber-300',\n        'bg-green-100 text-green-700 dark:bg-green-950 dark:text-green-300',\n        'bg-blue-100 text-blue-700 dark:bg-blue-950 dark:text-blue-300',\n        'bg-indigo-100 text-indigo-700 dark:bg-indigo-950 dark:text-indigo-300',\n        'bg-violet-100 text-violet-700 dark:bg-violet-950 dark:text-violet-300',\n        'bg-rose-100 text-rose-700 dark:bg-rose-950 dark:text-rose-300',\n    ];\n\n    $colorClasses = match ($color) {\n        'red' => $palette[0],\n        'orange' => $palette[1],\n        'amber' => $palette[2],\n        'green' => $palette[3],\n        'blue' => $palette[4],\n        'indigo' => $palette[5],\n        'violet' => $palette[6],\n        'rose' => $palette[7],\n        'auto' => $palette[crc32(filled($name) ? (string) $name : (string) ($resolvedInitials ?? 'A')) % count($palette)],\n        default => 'bg-zinc-100 text-zinc-700 dark:bg-zinc-800 dark:text-zinc-200',\n    };\n\n    $shapeClass = $circle ? 'rounded-full' : 'rounded-lg';\n    $useLink = filled($href) || $as === 'a';\n    $tag = $useLink ? 'a' : ($as === 'button' ? 'button' : 'span');\n@endphp\n\n<{{ $tag }}\n    {{\n        $attributes->class([\n            'avatar',\n            'relative inline-flex shrink-0 items-center justify-center overflow-hidden font-medium select-none',\n            $sizeClasses,\n            $shapeClass,\n            $colorClasses,\n            $useLink || $as === 'button'\n            ? 'focus-visible:outline-none focus-visible:ring-2 focus-visible:ring-zinc-950/10 dark:focus-visible:ring-zinc-300/20'\n            : null,\n        ])->merge([\n            'data-avatar' => true,\n            'data-size' => $size,\n            'href' => $useLink ? ($href ?? '#') : null,\n            'type' => $as === 'button' ? 'button' : null,\n        ])\n    }}\n>\n    @if (filled($src))\n        <x-ui::avatar.image :src=\"$src\" :alt=\"$resolvedAlt\" />\n        <x-ui::avatar.fallback>\n            {{ $resolvedInitials ?? mb_strtoupper(mb_substr((string) $resolvedAlt, 0, 1)) }}</x-ui::avatar.fallback>\n    @elseif (! $slot->isEmpty())\n        {{ $slot }}\n    @elseif (filled($resolvedInitials))\n        <x-ui::avatar.fallback>{{ $resolvedInitials }}</x-ui::avatar.fallback>\n    @else\n        {{ $slot }}\n    @endif\n</{{ $tag }}>\n"
        },
        {
            "path": "avatar/avatar.js",
            "type": "registry:ui",
            "target": "avatar/avatar.js",
            "content": "/**\n * Stencil \u2014 avatar image fallback (vanilla JS, no Alpine).\n */\n\nconst AVATAR_SELECTOR = '[data-avatar]';\nconst IMAGE_SELECTOR = '[data-avatar-image]';\nconst FALLBACK_SELECTOR = '[data-avatar-fallback]';\nconst initialized = new WeakSet();\n\n/**\n * @param {ParentNode} root\n */\nexport function initAvatars(root = document) {\n    root.querySelectorAll(AVATAR_SELECTOR).forEach((element) => {\n        if (!(element instanceof HTMLElement)) {\n            return;\n        }\n\n        if (initialized.has(element)) {\n            return;\n        }\n\n        initialized.add(element);\n        bindAvatar(element);\n    });\n}\n\n/**\n * @param {HTMLElement} avatar\n */\nfunction bindAvatar(avatar) {\n    const image = avatar.querySelector(IMAGE_SELECTOR);\n    const fallback = avatar.querySelector(FALLBACK_SELECTOR);\n\n    if (!(image instanceof HTMLImageElement) || !(fallback instanceof HTMLElement)) {\n        return;\n    }\n\n    fallback.hidden = true;\n\n    const hideImage = () => {\n        image.hidden = true;\n        image.classList.add('hidden');\n        fallback.hidden = false;\n        fallback.classList.remove('hidden');\n    };\n\n    if (image.complete && image.naturalWidth === 0) {\n        hideImage();\n\n        return;\n    }\n\n    image.addEventListener('error', hideImage, { once: true });\n}\n\ndocument.addEventListener('stencil:mount', (event) => {\n    if (!(event instanceof CustomEvent)) {\n        return;\n    }\n\n    const mountRoot = event.detail?.root;\n\n    if (!(mountRoot instanceof HTMLElement)) {\n        return;\n    }\n\n    initAvatars(mountRoot);\n});\n\nif (typeof document !== 'undefined') {\n    if (document.readyState === 'loading') {\n        document.addEventListener('DOMContentLoaded', () => initAvatars());\n    } else {\n        initAvatars();\n    }\n}\n"
        }
    ]
}
