{
    "$schema": "../schema/registry-item.json",
    "name": "pagination",
    "type": "registry:ui",
    "title": "Pagination",
    "description": "Page navigation controls with compound parts or a Laravel paginator shortcut.",
    "registryDependencies": [
        "icon"
    ],
    "files": [
        {
            "path": "pagination/content.blade.php",
            "type": "registry:ui",
            "target": "pagination/content.blade.php",
            "content": "<ul {{\n    $attributes->class([\n        'pagination__content',\n        'flex flex-row items-center gap-1',\n    ])->merge([\n        'data-pagination-content' => true,\n    ])\n}}>\n    {{ $slot }}\n</ul>\n"
        },
        {
            "path": "pagination/ellipsis.blade.php",
            "type": "registry:ui",
            "target": "pagination/ellipsis.blade.php",
            "content": "<span {{\n    $attributes->class([\n        'pagination__ellipsis',\n        'flex size-9 items-center justify-center',\n    ])->merge([\n        'aria-hidden' => 'true',\n        'data-pagination-ellipsis' => true,\n    ])\n}}>\n    <span class=\"text-zinc-500\">\u2026</span>\n    <span class=\"sr-only\">{{ __('stencil-ui::messages.pagination_ellipsis') }}</span>\n</span>\n"
        },
        {
            "path": "pagination/index.blade.php",
            "type": "registry:ui",
            "target": "pagination/index.blade.php",
            "content": "@props([\n    'paginator' => null,\n])\n\n@php\n    use Illuminate\\Contracts\\Pagination\\LengthAwarePaginator;\n\n    $hasPaginator = $paginator instanceof LengthAwarePaginator;\n@endphp\n\n<nav {{\n    $attributes->class([\n        'pagination',\n        'mx-auto flex w-full justify-center',\n    ])->merge([\n        'role' => 'navigation',\n        'aria-label' => 'pagination',\n        'data-pagination' => true,\n    ])\n}}>\n    @if ($hasPaginator)\n        <x-ui::pagination.content>\n            <x-ui::pagination.item>\n                <x-ui::pagination.previous\n                    :href=\"$paginator->previousPageUrl() ?? '#'\"\n                    :disabled=\"$paginator->onFirstPage()\"\n                />\n            </x-ui::pagination.item>\n\n            @foreach ($paginator->getUrlRange(max(1, $paginator->currentPage() - 1), min($paginator->lastPage(), $paginator->currentPage() + 1)) as $page => $url)\n                <x-ui::pagination.item>\n                    <x-ui::pagination.link :href=\"$url\" :is-active=\"$page === $paginator->currentPage()\">\n                        {{ $page }}\n                    </x-ui::pagination.link>\n                </x-ui::pagination.item>\n            @endforeach\n\n            <x-ui::pagination.item>\n                <x-ui::pagination.next\n                    :href=\"$paginator->nextPageUrl() ?? '#'\"\n                    :disabled=\"! $paginator->hasMorePages()\"\n                />\n            </x-ui::pagination.item>\n        </x-ui::pagination.content>\n    @else\n        {{ $slot }}\n    @endif\n</nav>\n"
        },
        {
            "path": "pagination/item.blade.php",
            "type": "registry:ui",
            "target": "pagination/item.blade.php",
            "content": "<li {{\n    $attributes->class([\n        'pagination__item',\n    ])->merge([\n        'data-pagination-item' => true,\n    ])\n}}>\n    {{ $slot }}\n</li>\n"
        },
        {
            "path": "pagination/link.blade.php",
            "type": "registry:ui",
            "target": "pagination/link.blade.php",
            "content": "@props([\n    'href' => '#',\n    'isActive' => false,\n    'disabled' => false,\n])\n\n@php\n    $isDisabled = (bool) $disabled;\n    $tag = $isDisabled ? 'span' : 'a';\n@endphp\n\n<{{ $tag }}\n    {{\n        $attributes->class([\n            'pagination__link',\n            'inline-flex size-9 items-center justify-center rounded-md text-sm font-medium transition-colors',\n            'focus-visible:outline-none focus-visible:ring-2 focus-visible:ring-zinc-950/10 dark:focus-visible:ring-zinc-300/20',\n            $isActive\n            ? 'border border-zinc-200 bg-white text-zinc-950 shadow-sm dark:border-zinc-700 dark:bg-zinc-950 dark:text-zinc-50'\n            : 'text-zinc-600 hover:bg-zinc-100 hover:text-zinc-950 dark:text-zinc-400 dark:hover:bg-zinc-800 dark:hover:text-zinc-50',\n            $isDisabled ? 'pointer-events-none opacity-50' : null,\n        ])->merge([\n            'href' => $isDisabled ? null : $href,\n            'aria-current' => $isActive ? 'page' : null,\n            'aria-disabled' => $isDisabled ? 'true' : null,\n            'data-pagination-link' => true,\n            'data-active' => $isActive ? 'true' : null,\n        ])\n    }}\n>\n    {{ $slot }}\n</{{ $tag }}>\n"
        },
        {
            "path": "pagination/next.blade.php",
            "type": "registry:ui",
            "target": "pagination/next.blade.php",
            "content": "@props([\n    'href' => '#',\n    'disabled' => false,\n    'text' => null,\n])\n\n<x-ui::pagination.link\n    :href=\"$href\"\n    :disabled=\"$disabled\"\n    {{ $attributes->class(['gap-1 px-2.5 w-auto min-w-9'])->merge(['aria-label' => __('stencil-ui::messages.pagination_next')]) }}\n>\n    <span class=\"hidden sm:inline\">{{ $text ?? __('stencil-ui::messages.pagination_next') }}</span>\n    <x-ui::icon name=\"chevron-right\" class=\"size-4\" />\n</x-ui::pagination.link>\n"
        },
        {
            "path": "pagination/previous.blade.php",
            "type": "registry:ui",
            "target": "pagination/previous.blade.php",
            "content": "@props([\n    'href' => '#',\n    'disabled' => false,\n    'text' => null,\n])\n\n<x-ui::pagination.link\n    :href=\"$href\"\n    :disabled=\"$disabled\"\n    {{ $attributes->class(['gap-1 px-2.5 w-auto min-w-9'])->merge(['aria-label' => __('stencil-ui::messages.pagination_previous')]) }}\n>\n    <x-ui::icon name=\"chevron-left\" class=\"size-4\" />\n    <span class=\"hidden sm:inline\">{{ $text ?? __('stencil-ui::messages.pagination_previous') }}</span>\n</x-ui::pagination.link>\n"
        }
    ],
    "iconDependencies": [
        "chevron-left",
        "chevron-right"
    ]
}
