{
    "$schema": "../schema/registry-item.json",
    "name": "button",
    "type": "registry:ui",
    "title": "Button",
    "description": "Composable button primitive with variants, sizes, link mode, and grouped layouts.",
    "registryDependencies": [
        "icon"
    ],
    "files": [
        {
            "path": "button/group/index.blade.php",
            "type": "registry:ui",
            "target": "button/group/index.blade.php",
            "content": "<div\n    {{ $attributes->class([\n        'button-group',\n        'inline-flex items-stretch',\n        '[&>[data-button]]:-ml-px [&>[data-button]:first-child]:ml-0',\n        '[&>[data-button]:not(:first-child)]:rounded-l-none',\n        '[&>[data-button]:not(:last-child)]:rounded-r-none',\n        '[&>[data-button]:focus-visible]:relative [&>[data-button]:focus-visible]:z-10',\n    ]) }}\n    data-button-group\n    role=\"group\"\n>\n    {{ $slot }}\n</div>\n"
        },
        {
            "path": "button/index.blade.php",
            "type": "registry:ui",
            "target": "button/index.blade.php",
            "content": "@props([\n    'variant' => 'outline',\n    'size' => null,\n    'color' => null,\n    'type' => 'button',\n    'href' => null,\n    'as' => null,\n    'square' => false,\n    'loading' => null,\n    'leading' => null,\n    'trailing' => null,\n])\n\n@php\n    use Illuminate\\View\\ComponentSlot;\n    use App\\Support\\Bladex\\Button\\ButtonClassMap;\n    use App\\Support\\Bladex\\Interaction\\InteractionStateAttributes;\n\n    $interactionState = app(InteractionStateAttributes::class);\n\n    $resolveAffix = static function (mixed $value): array {\n        if ($value instanceof ComponentSlot) {\n            return [! $value->isEmpty(), $value->isEmpty() ? null : $value];\n        }\n\n        if (filled($value)) {\n            return [true, $value];\n        }\n\n        return [false, null];\n    };\n\n    [$hasLeading, $leadingContent] = $resolveAffix($leading ?? null);\n    [$hasTrailing, $trailingContent] = $resolveAffix($trailing ?? null);\n\n    $slotEmpty = $slot->isEmpty();\n    $iconOnly = $slotEmpty && ($hasLeading || $hasTrailing || (bool) $square);\n\n    $classMap = app(ButtonClassMap::class);\n\n    $buttonClasses = $classMap->classes(\n        $variant,\n        $size,\n        $color,\n        [\n            'hasLeading' => $hasLeading,\n            'hasTrailing' => $hasTrailing,\n            'square' => (bool) $square,\n            'iconOnly' => $iconOnly,\n        ],\n    );\n\n    $useLink = filled($href) || $as === 'a';\n    $tag = $useLink ? 'a' : 'button';\n\n    $mergedAttributes = $attributes\n        ->except(['loading'])\n        ->class($buttonClasses)\n        ->merge([\n            'data-button' => true,\n        ]);\n\n    $mergedAttributes = $interactionState->apply($mergedAttributes, [\n        'nativeDisabled' => ! $useLink,\n        'loading' => $loading === true ? true : null,\n    ]);\n\n    $isLoading = $interactionState->isLoading($mergedAttributes);\n\n    if ($useLink) {\n        $mergedAttributes = $mergedAttributes->merge([\n            'href' => $href ?? '#',\n        ]);\n    } else {\n        $mergedAttributes = $mergedAttributes->merge([\n            'type' => $type,\n        ]);\n    }\n\n    if ($iconOnly) {\n        $mergedAttributes = $mergedAttributes->merge(['data-button-icon-only' => true]);\n    }\n@endphp\n\n<{{ $tag }} {{ $mergedAttributes }}>\n    @if ($hasLeading)\n        <span @class(['button__leading', 'inline-flex shrink-0 items-center']) data-button-leading>\n            @if ($leadingContent instanceof ComponentSlot)\n                {{ $leadingContent }}\n            @else\n                {{ $leadingContent }}\n            @endif\n        </span>\n    @endif\n\n    @unless ($slotEmpty)\n        <span @class(['button__label', 'inline-flex items-center']) data-button-label>\n            {{ $slot }}\n        </span>\n    @endunless\n\n    @if ($isLoading)\n        <span @class(['button__loading', 'inline-flex shrink-0 items-center']) data-button-loading aria-hidden=\"true\">\n            <x-ui::icon.loading />\n        </span>\n    @elseif ($hasTrailing)\n        <span @class(['button__trailing', 'inline-flex shrink-0 items-center']) data-button-trailing>\n            @if ($trailingContent instanceof ComponentSlot)\n                {{ $trailingContent }}\n            @else\n                {{ $trailingContent }}\n            @endif\n        </span>\n    @endif\n</{{ $tag }}>\n"
        }
    ]
}
