{
    "$schema": "../schema/registry-item.json",
    "name": "radio",
    "type": "registry:ui",
    "title": "Radio",
    "description": "Radio group and item primitives for single-choice form fields.",
    "registryDependencies": [
        "field",
        "label"
    ],
    "files": [
        {
            "path": "radio/group.blade.php",
            "type": "registry:ui",
            "target": "radio/group.blade.php",
            "content": "@props([\n    'name' => null,\n    'value' => null,\n    'legend' => null,\n    'invalid' => false,\n])\n\n@aware([\n    'fieldInvalid' => false,\n])\n\n@php\n    $isInvalid = $invalid || $fieldInvalid;\n\n    $groupAttributes = $attributes\n        ->class([\n            'radio-group',\n            'flex flex-col gap-3',\n        ])\n        ->merge([\n            'data-radio-group' => true,\n        ]);\n\n    if ($isInvalid) {\n        $groupAttributes = $groupAttributes->merge(['aria-invalid' => 'true']);\n    }\n@endphp\n\n<fieldset {{ $groupAttributes }}>\n    @if (filled($legend))\n        <legend class=\"mb-1\">\n            <x-ui::text\n                size=\"sm\"\n                class=\"font-medium text-zinc-950 dark:text-zinc-50\"\n            >{{ $legend }}</x-ui::text>\n        </legend>\n    @endif\n\n    {{ $slot }}\n</fieldset>\n"
        },
        {
            "path": "radio/index.blade.php",
            "type": "registry:ui",
            "target": "radio/index.blade.php",
            "content": "@props([\n    'value' => null,\n    'checked' => false,\n    'invalid' => false,\n    'size' => null,\n    'label' => null,\n])\n\n@aware([\n    'name' => null,\n    'fieldInvalid' => false,\n])\n\n@php\n    use App\\Support\\Stencil\\Form\\FormControlClassMap;\n    use App\\Support\\Stencil\\Interaction\\InteractionStateAttributes;\n\n    $isInvalid = $invalid || $fieldInvalid;\n\n    $formControl = app(FormControlClassMap::class);\n    $interactionState = app(InteractionStateAttributes::class);\n\n    $controlId = $attributes->get('id') ?? 'radio-'.str_replace('.', '', uniqid('', true));\n\n    $controlClasses = collect([\n        $formControl->choiceControlClasses('radio', $size),\n        'appearance-none',\n        'checked:border-zinc-900',\n        'dark:checked:border-zinc-50',\n    ])->implode(' ');\n\n    $controlAttributes = $interactionState->apply(\n        $attributes\n            ->except('id')\n            ->class($controlClasses)\n            ->merge([\n                'type' => 'radio',\n                'id' => $controlId,\n                'data-radio-control' => true,\n            ]),\n        ['nativeDisabled' => true],\n    );\n\n    if (filled($name)) {\n        $controlAttributes = $controlAttributes->merge(['name' => $name]);\n    }\n\n    if (filled($value)) {\n        $controlAttributes = $controlAttributes->merge(['value' => $value]);\n    }\n\n    if ($checked) {\n        $controlAttributes = $controlAttributes->merge(['checked' => true]);\n    }\n\n    if ($isInvalid) {\n        $controlAttributes = $controlAttributes->merge(['aria-invalid' => 'true']);\n    }\n\n    $hasSlotLabel = ! $slot->isEmpty();\n@endphp\n\n<div class=\"radio flex items-start gap-2\" data-radio>\n    <input {{ $controlAttributes }} />\n\n    @if ($hasSlotLabel)\n        <x-ui::label :for=\"$controlId\" class=\"!font-normal\"> {{ $slot }} </x-ui::label>\n    @elseif (filled($label))\n        <x-ui::label :for=\"$controlId\" class=\"!font-normal\"> {{ $label }} </x-ui::label>\n    @endif\n</div>\n"
        }
    ]
}
