{
    "$schema": "../schema/registry-item.json",
    "name": "collapsible",
    "type": "registry:ui",
    "title": "Collapsible",
    "description": "Accessible single-panel expand/collapse primitive with optional transition.",
    "registryDependencies": [],
    "files": [
        {
            "path": "collapsible/content.blade.php",
            "type": "registry:ui",
            "target": "collapsible/content.blade.php",
            "content": "@props([])\n\n@aware([\n    'open' => false,\n    'transition' => false,\n])\n\n@php\n    $isOpen = (bool) $open;\n@endphp\n\n<div {{\n    $attributes->class([\n        'collapsible__content',\n        'overflow-hidden text-sm text-zinc-600 dark:text-zinc-400',\n        $transition\n        ? 'motion-safe:transition-[grid-template-rows,opacity] motion-safe:duration-200 motion-safe:ease-[cubic-bezier(0.16,1,0.3,1)] grid'\n        : null,\n        $transition && $isOpen ? 'grid-rows-[1fr] opacity-100' : null,\n        $transition && ! $isOpen ? 'grid-rows-[0fr] opacity-0' : null,\n        ! $transition && ! $isOpen ? 'hidden' : null,\n    ])->merge([\n        'data-collapsible-content' => true,\n        'data-state' => $isOpen ? 'open' : 'closed',\n        'hidden' => (! $transition && ! $isOpen) ? true : null,\n    ])\n}}>\n    <div class=\"collapsible__content-inner min-h-0\" data-collapsible-content-inner>{{ $slot }}</div>\n</div>\n"
        },
        {
            "path": "collapsible/index.blade.php",
            "type": "registry:ui",
            "target": "collapsible/index.blade.php",
            "content": "@props([\n    'open' => false,\n    'disabled' => false,\n    'transition' => false,\n])\n\n@php\n    $isOpen = (bool) $open;\n    $isDisabled = (bool) $disabled;\n    $baseId = 'collapsible-'.str_replace('.', '', uniqid('', true));\n@endphp\n\n<div {{\n    $attributes->class([\n        'collapsible',\n        'w-full',\n    ])->merge([\n        'data-collapsible' => true,\n        'data-state' => $isOpen ? 'open' : 'closed',\n        'data-collapsible-transition' => $transition ? 'true' : 'false',\n        'data-collapsible-disabled' => $isDisabled ? 'true' : null,\n        'data-collapsible-trigger-id' => $baseId.'-trigger',\n        'data-collapsible-content-id' => $baseId.'-content',\n    ])\n}}>\n    {{ $slot }}\n</div>\n"
        },
        {
            "path": "collapsible/trigger.blade.php",
            "type": "registry:ui",
            "target": "collapsible/trigger.blade.php",
            "content": "@props([\n    'asChild' => false,\n])\n\n@aware([\n    'open' => false,\n    'disabled' => false,\n])\n\n@php\n    $isOpen = (bool) $open;\n    $isDisabled = (bool) $disabled;\n@endphp\n\n@if ($asChild)\n    <div {{\n        $attributes->class(['collapsible__trigger', 'contents'])->merge([\n            'data-collapsible-trigger' => true,\n        ])\n    }}>\n        {{ $slot }}\n    </div>\n@else\n    <button\n        type=\"button\"\n        {{\n            $attributes->class([\n                'collapsible__trigger',\n                'inline-flex items-center gap-2 text-sm font-medium text-zinc-950',\n                'transition-colors hover:text-zinc-700 focus-visible:outline-none focus-visible:ring-2 focus-visible:ring-zinc-950/10',\n                'disabled:pointer-events-none disabled:opacity-50',\n                'dark:text-zinc-50 dark:hover:text-zinc-300 dark:focus-visible:ring-zinc-300/20',\n            ])->merge([\n                'data-collapsible-trigger' => true,\n                'aria-expanded' => $isOpen ? 'true' : 'false',\n                'disabled' => $isDisabled ? true : null,\n            ])\n        }}\n    >\n        {{ $slot }}\n    </button>\n@endif\n"
        },
        {
            "path": "collapsible/collapsible.js",
            "type": "registry:ui",
            "target": "collapsible/collapsible.js",
            "content": "/**\n * Stencil \u2014 accessible collapsible panel (vanilla JS, no Alpine).\n */\n\nconst COLLAPSIBLE_SELECTOR = '[data-collapsible]';\nconst TRIGGER_SELECTOR = '[data-collapsible-trigger]';\nconst CONTENT_SELECTOR = '[data-collapsible-content]';\nconst initialized = new WeakSet();\n\n/**\n * @param {ParentNode} root\n */\nexport function initCollapsibles(root = document) {\n    root.querySelectorAll(COLLAPSIBLE_SELECTOR).forEach((element) => {\n        if (!(element instanceof HTMLElement)) {\n            return;\n        }\n\n        if (initialized.has(element)) {\n            return;\n        }\n\n        initialized.add(element);\n        bindCollapsible(element);\n    });\n}\n\n/**\n * @param {HTMLElement} root\n */\nfunction bindCollapsible(root) {\n    const trigger = root.querySelector(TRIGGER_SELECTOR);\n    const content = root.querySelector(CONTENT_SELECTOR);\n\n    if (!(trigger instanceof HTMLElement) || !(content instanceof HTMLElement)) {\n        return;\n    }\n\n    const triggerId = root.dataset.collapsibleTriggerId\n        ?? `collapsible-trigger-${Math.random().toString(36).slice(2, 10)}`;\n    const contentId = root.dataset.collapsibleContentId\n        ?? `collapsible-content-${Math.random().toString(36).slice(2, 10)}`;\n\n    const control = resolveControl(trigger);\n\n    if (control instanceof HTMLElement) {\n        if (!control.id) {\n            control.id = triggerId;\n        }\n\n        control.setAttribute('aria-controls', contentId);\n        control.setAttribute('aria-expanded', root.dataset.state === 'open' ? 'true' : 'false');\n    }\n\n    if (!content.id) {\n        content.id = contentId;\n    }\n\n    applyState(root, root.dataset.state === 'open');\n\n    const clickTarget = trigger.matches(TRIGGER_SELECTOR) && trigger.tagName === 'DIV'\n        ? trigger\n        : control ?? trigger;\n\n    clickTarget.addEventListener('click', (event) => {\n        if (root.dataset.collapsibleDisabled === 'true') {\n            return;\n        }\n\n        if (control instanceof HTMLButtonElement && control.disabled) {\n            return;\n        }\n\n        event.preventDefault();\n        toggle(root);\n    });\n}\n\n/**\n * @param {HTMLElement} trigger\n * @returns {HTMLElement | null}\n */\nfunction resolveControl(trigger) {\n    if (trigger.tagName === 'BUTTON') {\n        return trigger;\n    }\n\n    const nested = trigger.querySelector('button, [role=\"button\"], a[href]');\n\n    return nested instanceof HTMLElement ? nested : trigger;\n}\n\n/**\n * @param {HTMLElement} root\n */\nfunction toggle(root) {\n    const open = root.dataset.state !== 'open';\n    applyState(root, open);\n\n    root.dispatchEvent(\n        new CustomEvent('stencil:collapsible:change', {\n            bubbles: true,\n            detail: { open },\n        }),\n    );\n}\n\n/**\n * @param {HTMLElement} root\n * @param {boolean} open\n */\nfunction applyState(root, open) {\n    const trigger = root.querySelector(TRIGGER_SELECTOR);\n    const content = root.querySelector(CONTENT_SELECTOR);\n    const transition = root.dataset.collapsibleTransition === 'true';\n    const control = trigger instanceof HTMLElement ? resolveControl(trigger) : null;\n\n    root.dataset.state = open ? 'open' : 'closed';\n\n    if (control instanceof HTMLElement) {\n        control.setAttribute('aria-expanded', open ? 'true' : 'false');\n    }\n\n    if (!(content instanceof HTMLElement)) {\n        return;\n    }\n\n    content.dataset.state = open ? 'open' : 'closed';\n\n    if (transition) {\n        content.classList.toggle('grid-rows-[1fr]', open);\n        content.classList.toggle('opacity-100', open);\n        content.classList.toggle('grid-rows-[0fr]', !open);\n        content.classList.toggle('opacity-0', !open);\n        content.classList.remove('hidden');\n        content.hidden = false;\n    } else if (open) {\n        content.hidden = false;\n        content.classList.remove('hidden');\n    } else {\n        content.hidden = true;\n        content.classList.add('hidden');\n    }\n}\n\ndocument.addEventListener('stencil:mount', (event) => {\n    if (!(event instanceof CustomEvent)) {\n        return;\n    }\n\n    const mountRoot = event.detail?.root;\n\n    if (!(mountRoot instanceof HTMLElement)) {\n        return;\n    }\n\n    initCollapsibles(mountRoot);\n});\n\nif (typeof document !== 'undefined') {\n    if (document.readyState === 'loading') {\n        document.addEventListener('DOMContentLoaded', () => initCollapsibles());\n    } else {\n        initCollapsibles();\n    }\n}\n"
        }
    ]
}
