{
    "$schema": "../schema/registry-item.json",
    "name": "toggle",
    "type": "registry:ui",
    "title": "Toggle",
    "description": "Two-state pressed button control with outline/default variants and size scale.",
    "registryDependencies": [],
    "files": [
        {
            "path": "toggle/index.blade.php",
            "type": "registry:ui",
            "target": "toggle/index.blade.php",
            "content": "@props([\n    'pressed' => false,\n    'variant' => 'default',\n    'size' => null,\n])\n\n@php\n    use App\\Support\\Stencil\\Interaction\\InteractionStateAttributes;\n\n    $interactionState = app(InteractionStateAttributes::class);\n\n    $variant = in_array($variant, ['default', 'outline'], true) ? $variant : 'default';\n    $size = match ($size) {\n        'sm', 'lg' => $size,\n        'xs' => 'sm',\n        default => 'default',\n    };\n    $isPressed = filter_var($pressed, FILTER_VALIDATE_BOOLEAN);\n\n    $sizeClasses = match ($size) {\n        'sm' => 'h-8 min-w-8 px-1.5 text-sm',\n        'lg' => 'h-10 min-w-10 px-2.5 text-base',\n        default => 'h-9 min-w-9 px-2 text-sm',\n    };\n\n    $variantClasses = match ($variant) {\n        'outline' => implode(' ', [\n            'border border-zinc-200 bg-transparent shadow-sm',\n            'hover:bg-zinc-100 hover:text-zinc-900',\n            'dark:border-zinc-800 dark:hover:bg-zinc-800 dark:hover:text-zinc-50',\n        ]),\n        default => implode(' ', [\n            'bg-transparent',\n            'hover:bg-zinc-100 hover:text-zinc-900',\n            'dark:hover:bg-zinc-800 dark:hover:text-zinc-50',\n        ]),\n    };\n\n    $mergedAttributes = $interactionState->apply(\n        $attributes\n            ->class([\n                'toggle',\n                'inline-flex items-center justify-center gap-2 whitespace-nowrap rounded-md font-medium',\n                'transition-colors outline-none',\n                'focus-visible:ring-2 focus-visible:ring-zinc-950/10 dark:focus-visible:ring-zinc-300/20',\n                'disabled:pointer-events-none disabled:opacity-50',\n                'cursor-pointer',\n                '[&_svg]:pointer-events-none [&_svg]:shrink-0 [&_svg:not([class*=size-])]:size-4',\n                'data-[state=on]:bg-zinc-100 data-[state=on]:text-zinc-900',\n                'dark:data-[state=on]:bg-zinc-800 dark:data-[state=on]:text-zinc-50',\n                $sizeClasses,\n                $variantClasses,\n            ])\n            ->merge([\n                'type' => 'button',\n                'data-toggle' => true,\n                'data-variant' => $variant,\n                'data-size' => $size,\n                'data-state' => $isPressed ? 'on' : 'off',\n                'aria-pressed' => $isPressed ? 'true' : 'false',\n            ]),\n        ['nativeDisabled' => true],\n    );\n@endphp\n\n<button {{ $mergedAttributes }}>{{ $slot }}</button>\n"
        },
        {
            "path": "toggle/toggle.js",
            "type": "registry:ui",
            "target": "toggle/toggle.js",
            "content": "/**\n * Stencil \u2014 accessible toggle button (vanilla JS, no Alpine).\n */\n\nconst TOGGLE_SELECTOR = '[data-toggle]';\nconst initialized = new WeakSet();\n\n/**\n * @param {ParentNode} root\n */\nexport function initToggles(root = document) {\n    root.querySelectorAll(TOGGLE_SELECTOR).forEach((element) => {\n        if (!(element instanceof HTMLButtonElement)) {\n            return;\n        }\n\n        if (initialized.has(element)) {\n            return;\n        }\n\n        // Group items are handled by toggle-group.js.\n        if (element.closest('[data-toggle-group]')) {\n            return;\n        }\n\n        initialized.add(element);\n        bindToggle(element);\n    });\n}\n\n/**\n * @param {HTMLButtonElement} button\n */\nfunction bindToggle(button) {\n    const setPressed = (pressed) => {\n        button.dataset.state = pressed ? 'on' : 'off';\n        button.setAttribute('aria-pressed', pressed ? 'true' : 'false');\n\n        button.dispatchEvent(\n            new CustomEvent('stencil:toggle:change', {\n                bubbles: true,\n                detail: { pressed },\n            }),\n        );\n    };\n\n    button.addEventListener('click', () => {\n        if (button.disabled) {\n            return;\n        }\n\n        setPressed(button.getAttribute('aria-pressed') !== 'true');\n    });\n}\n\ndocument.addEventListener('stencil:mount', (event) => {\n    if (!(event instanceof CustomEvent)) {\n        return;\n    }\n\n    const mountRoot = event.detail?.root;\n\n    if (!(mountRoot instanceof HTMLElement)) {\n        return;\n    }\n\n    initToggles(mountRoot);\n});\n\nif (typeof document !== 'undefined') {\n    if (document.readyState === 'loading') {\n        document.addEventListener('DOMContentLoaded', () => initToggles());\n    } else {\n        initToggles();\n    }\n}\n"
        }
    ]
}
