{
    "$schema": "../schema/registry-item.json",
    "name": "badge",
    "type": "registry:ui",
    "title": "Badge",
    "description": "Compact status label with variants, colors, sizes, and optional close control.",
    "registryDependencies": [
        "icon"
    ],
    "files": [
        {
            "path": "badge/close.blade.php",
            "type": "registry:ui",
            "target": "badge/close.blade.php",
            "content": "<button\n    type=\"button\"\n    {{\n        $attributes->class([\n            'badge__close',\n            '-me-0.5 inline-flex size-3.5 items-center justify-center rounded-sm opacity-70 transition hover:opacity-100',\n            'focus-visible:outline-none focus-visible:ring-2 focus-visible:ring-zinc-950/10 dark:focus-visible:ring-zinc-300/20',\n        ])->merge([\n            'data-badge-close' => true,\n            'aria-label' => __('stencil-ui::messages.badge_close'),\n        ])\n    }}\n>\n    @if ($slot->isEmpty())\n        <x-ui::icon name=\"x\" class=\"size-3\" />\n    @else\n        {{ $slot }}\n    @endif\n</button>\n"
        },
        {
            "path": "badge/index.blade.php",
            "type": "registry:ui",
            "target": "badge/index.blade.php",
            "content": "@props([\n    'variant' => 'secondary',\n    'color' => null,\n    'size' => null,\n    'rounded' => false,\n    'href' => null,\n    'as' => null,\n])\n\n@php\n    $sizeClasses = match ($size) {\n        'sm' => 'px-1.5 py-0 text-[10px]',\n        'lg' => 'px-2.5 py-1 text-sm',\n        default => 'px-2 py-0.5 text-xs',\n    };\n\n    $baseClasses = [\n        'badge',\n        'inline-flex items-center gap-1 font-medium whitespace-nowrap',\n        $rounded ? 'rounded-full' : 'rounded-md',\n        $sizeClasses,\n    ];\n\n    $variantClasses = match (true) {\n        filled($color) && $variant === 'solid' => match ($color) {\n            'red' => 'bg-red-600 text-white',\n            'orange' => 'bg-orange-600 text-white',\n            'amber' => 'bg-amber-500 text-zinc-950',\n            'green' => 'bg-green-600 text-white',\n            'blue' => 'bg-blue-600 text-white',\n            'indigo' => 'bg-indigo-600 text-white',\n            'violet' => 'bg-violet-600 text-white',\n            'rose' => 'bg-rose-600 text-white',\n            'lime' => 'bg-lime-500 text-zinc-950',\n            default => 'bg-zinc-900 text-white dark:bg-zinc-100 dark:text-zinc-900',\n        },\n        filled($color) => match ($color) {\n            'red' => 'bg-red-100 text-red-700 dark:bg-red-950 dark:text-red-300',\n            'orange' => 'bg-orange-100 text-orange-700 dark:bg-orange-950 dark:text-orange-300',\n            'amber' => 'bg-amber-100 text-amber-800 dark:bg-amber-950 dark:text-amber-300',\n            'green' => 'bg-green-100 text-green-700 dark:bg-green-950 dark:text-green-300',\n            'blue' => 'bg-blue-100 text-blue-700 dark:bg-blue-950 dark:text-blue-300',\n            'indigo' => 'bg-indigo-100 text-indigo-700 dark:bg-indigo-950 dark:text-indigo-300',\n            'violet' => 'bg-violet-100 text-violet-700 dark:bg-violet-950 dark:text-violet-300',\n            'rose' => 'bg-rose-100 text-rose-700 dark:bg-rose-950 dark:text-rose-300',\n            'lime' => 'bg-lime-100 text-lime-800 dark:bg-lime-950 dark:text-lime-300',\n            default => 'bg-zinc-100 text-zinc-700 dark:bg-zinc-800 dark:text-zinc-200',\n        },\n        $variant === 'default' || $variant === 'primary' => 'bg-zinc-900 text-zinc-50 dark:bg-zinc-50 dark:text-zinc-900',\n        $variant === 'destructive' || $variant === 'danger' => 'bg-red-600 text-white',\n        $variant === 'outline' => 'border border-zinc-200 bg-transparent text-zinc-700 dark:border-zinc-700 dark:text-zinc-200',\n        $variant === 'ghost' => 'bg-transparent text-zinc-600 dark:text-zinc-300',\n        $variant === 'solid' => 'bg-zinc-900 text-white dark:bg-zinc-100 dark:text-zinc-900',\n        default => 'bg-zinc-100 text-zinc-700 dark:bg-zinc-800 dark:text-zinc-200',\n    };\n\n    $useLink = filled($href) || $as === 'a';\n    $tag = $useLink ? 'a' : ($as === 'button' ? 'button' : 'span');\n@endphp\n\n<{{ $tag }}\n    {{\n        $attributes->class([\n            ...$baseClasses,\n            $variantClasses,\n            $useLink || $as === 'button'\n            ? 'focus-visible:outline-none focus-visible:ring-2 focus-visible:ring-zinc-950/10 dark:focus-visible:ring-zinc-300/20'\n            : null,\n        ])->merge([\n            'data-badge' => true,\n            'data-variant' => $variant,\n            'href' => $useLink ? ($href ?? '#') : null,\n            'type' => $as === 'button' ? 'button' : null,\n        ])\n    }}\n>\n    {{ $slot }}\n</{{ $tag }}>\n"
        }
    ],
    "iconDependencies": [
        "x"
    ]
}
