{
    "$schema": "../schema/registry-item.json",
    "name": "checkbox",
    "type": "registry:ui",
    "title": "Checkbox",
    "description": "Native checkbox control with Stencil field surface and invalid states.",
    "registryDependencies": [
        "field"
    ],
    "files": [
        {
            "path": "checkbox/index.blade.php",
            "type": "registry:ui",
            "target": "checkbox/index.blade.php",
            "content": "@props([\n    'name' => null,\n    'value' => '1',\n    'checked' => false,\n    'invalid' => false,\n    'size' => null,\n])\n\n@aware([\n    'fieldInvalid' => false,\n])\n\n@php\n    use App\\Support\\Stencil\\Form\\FormControlClassMap;\n    use App\\Support\\Stencil\\Interaction\\InteractionStateAttributes;\n\n    $isInvalid = $invalid || $fieldInvalid;\n\n    $formControl = app(FormControlClassMap::class);\n    $interactionState = app(InteractionStateAttributes::class);\n\n    // Checkmark SVG is applied in stencil.css \u2014 Tailwind does not emit\n    // checked:bg-[url(data:...)] when the class lives only inside a PHP string.\n    $controlClasses = collect([\n        $formControl->choiceControlClasses('checkbox', $size),\n        'appearance-none',\n        'checked:border-zinc-900 checked:bg-zinc-900',\n        'dark:checked:border-zinc-50 dark:checked:bg-zinc-50',\n    ])->implode(' ');\n\n    $controlAttributes = $interactionState->apply(\n        $attributes\n            ->class($controlClasses)\n            ->merge([\n                'type' => 'checkbox',\n                'data-checkbox-control' => true,\n            ]),\n        ['nativeDisabled' => true],\n    );\n\n    if (filled($name)) {\n        $controlAttributes = $controlAttributes->merge(['name' => $name]);\n    }\n\n    if (filled($value)) {\n        $controlAttributes = $controlAttributes->merge(['value' => $value]);\n    }\n\n    if ($checked) {\n        $controlAttributes = $controlAttributes->merge(['checked' => true]);\n    }\n\n    if ($isInvalid) {\n        $controlAttributes = $controlAttributes->merge(['aria-invalid' => 'true']);\n    }\n@endphp\n\n<div class=\"checkbox inline-flex items-center\" data-checkbox>\n    <input {{ $controlAttributes }} />\n</div>\n"
        }
    ]
}
