{
    "$schema": "../schema/registry-item.json",
    "name": "field",
    "type": "registry:ui",
    "title": "Field",
    "description": "Composable form field shell with label, description, messages, and validation errors.",
    "registryDependencies": [
        "label",
        "text"
    ],
    "files": [
        {
            "path": "field/description.blade.php",
            "type": "registry:ui",
            "target": "field/description.blade.php",
            "content": "<x-ui::field.message {{ $attributes }}> {{ $slot }} </x-ui::field.message>\n"
        },
        {
            "path": "field/errors.blade.php",
            "type": "registry:ui",
            "target": "field/errors.blade.php",
            "content": "@props([\n    'name',\n])\n\n@error($name)\n    <x-ui::field.message variant=\"error\">{{ $message }}</x-ui::field.message>\n@enderror\n"
        },
        {
            "path": "field/label.blade.php",
            "type": "registry:ui",
            "target": "field/label.blade.php",
            "content": "@aware([\n    'name' => null,\n    'controlId' => null,\n])\n\n@php\n    $for = $attributes->get('for') ?? $controlId ?? $name;\n@endphp\n\n<x-ui::label :for=\"$for\" {{ $attributes->except('for') }}> {{ $slot }} </x-ui::label>\n"
        },
        {
            "path": "field/message.blade.php",
            "type": "registry:ui",
            "target": "field/message.blade.php",
            "content": "@props([\n    'variant' => 'hint',\n    'invalid' => false,\n])\n\n@aware([\n    'fieldInvalid' => false,\n])\n\n@php\n    $isError = $variant === 'error' || $invalid || $fieldInvalid;\n    $messageVariant = $isError ? 'error' : 'subtle';\n\n    $attributes = $attributes\n        ->class('field__message')\n        ->merge([\n            'size' => 'sm',\n            'variant' => $messageVariant,\n            'data-field-message' => true,\n            'data-field-message-variant' => $isError ? 'error' : 'hint',\n        ]);\n\n    if ($isError) {\n        $attributes = $attributes->merge(['role' => 'alert']);\n    }\n@endphp\n\n<x-ui::text {{ $attributes }}> {{ $slot }} </x-ui::text>\n"
        },
        {
            "path": "field/wrapper.blade.php",
            "type": "registry:ui",
            "target": "field/wrapper.blade.php",
            "content": "@php\n    $isInline = $orientation === 'inline';\n\n    $rootClasses = collect([\n        'field',\n        'flex min-w-0',\n        $isInline ? 'flex-row items-center gap-3' : 'flex-col gap-1.5',\n    ])->implode(' ');\n@endphp\n\n<div {{\n    $attributes->class($rootClasses)->merge([\n        'data-field' => true,\n        'data-field-orientation' => $isInline ? 'inline' : 'block',\n        'data-invalid' => $fieldInvalid ? 'true' : 'false',\n    ])\n}}>\n    {{ $slot }}\n</div>\n"
        },
        {
            "path": "app/View/Components/Ui/Field.php",
            "type": "registry:app",
            "target": "app/View/Components/Ui/Field.php",
            "content": "<?php\n\ndeclare(strict_types=1);\n\nnamespace App\\View\\Components\\Ui;\n\nuse Illuminate\\Contracts\\View\\View;\nuse Illuminate\\Support\\Facades\\View as ViewFactory;\nuse Illuminate\\Support\\ViewErrorBag;\nuse Illuminate\\View\\Component;\n\nfinal class Field extends Component\n{\n    public bool $fieldInvalid;\n\n    public function __construct(\n        public ?string $name = null,\n        public bool $invalid = false,\n        public string $orientation = 'block',\n        public ?string $controlId = null,\n    ) {\n        $this->fieldInvalid = $invalid;\n\n        if ($this->fieldInvalid || ! filled($name)) {\n            return;\n        }\n\n        $errors = ViewFactory::shared('errors');\n\n        if ($errors instanceof ViewErrorBag && $errors->has($name)) {\n            $this->fieldInvalid = true;\n        }\n    }\n\n    public function render(): View\n    {\n        return view('ui::field.wrapper');\n    }\n}\n"
        }
    ]
}
