{
    "$schema": "../schema/registry-item.json",
    "name": "switch",
    "type": "registry:ui",
    "title": "Switch",
    "description": "Toggle switch control using role=\"switch\" for binary settings.",
    "registryDependencies": [
        "field"
    ],
    "files": [
        {
            "path": "switch/index.blade.php",
            "type": "registry:ui",
            "target": "switch/index.blade.php",
            "content": "@props([\n    'name' => null,\n    'value' => '1',\n    'checked' => false,\n    'invalid' => false,\n    'size' => null,\n])\n\n@aware([\n    'fieldInvalid' => false,\n])\n\n@php\n    use App\\Support\\Stencil\\Form\\FormControlClassMap;\n    use App\\Support\\Stencil\\Interaction\\InteractionStateAttributes;\n\n    $isInvalid = $invalid || $fieldInvalid;\n\n    $formControl = app(FormControlClassMap::class);\n    $interactionState = app(InteractionStateAttributes::class);\n\n    $controlId = $attributes->get('id') ?? 'switch-'.str_replace('.', '', uniqid('', true));\n\n    $trackClasses = $formControl->switchTrackClasses($size);\n    $thumbClasses = $formControl->switchThumbClasses($size);\n\n    $wrapperClass = $attributes->get('class');\n\n    $controlAttributes = $interactionState->apply(\n        $attributes\n            ->except(['id', 'class'])\n            ->class([\n                'switch__input',\n                'sr-only',\n            ])\n            ->merge([\n                'type' => 'checkbox',\n                'role' => 'switch',\n                'id' => $controlId,\n                'data-switch-control' => true,\n            ]),\n        ['nativeDisabled' => true],\n    );\n\n    if (filled($name)) {\n        $controlAttributes = $controlAttributes->merge(['name' => $name]);\n    }\n\n    if (filled($value)) {\n        $controlAttributes = $controlAttributes->merge(['value' => $value]);\n    }\n\n    if ($checked) {\n        $controlAttributes = $controlAttributes->merge(['checked' => true]);\n    }\n\n    if ($isInvalid) {\n        $controlAttributes = $controlAttributes->merge(['aria-invalid' => 'true']);\n    }\n@endphp\n\n<label\n    @class([\n        'switch inline-flex cursor-pointer items-center',\n        $size === 'sm' ? 'switch--sm' : null,\n        $wrapperClass,\n    ])\n    data-switch\n    @if ($checked) data-checked @endif\n>\n    <input {{ $controlAttributes }} />\n    <span\n        class=\"{{ $trackClasses }}\"\n        aria-hidden=\"true\"\n        data-switch-track\n    >\n        <span class=\"{{ $thumbClasses }}\" data-switch-thumb></span>\n    </span>\n</label>\n"
        }
    ]
}
